{
  "schema_version": 2,
  "capture_id": "CP-018fa2b3-12cd-7abc-8abc-0123456789ab",
  "device_id": "DEV-SAMPLE",
  "captured_at": "2026-10-09T20:43:00+09:00",
  "ingest_channel": "filesystem-drop",
  "source_type": "local-file",
  "size_bytes": 16,
  "sha256": "5d000b44db178b31c4aca20a5ef5741adb7e14b8297a2139e83f4119c783dd5f",
  "sha512": "20c46b2e7a15a386565c2bd6c76c6948f6b4e3afbf3ac7c62a53967335a39d7ff8e229dd1a692b822495cc0f60485cdd2ac5c29ebc7130738967ac13ea68dbec",
  "status": "READY",
  "original_filename": "synthetic.txt",
  "collector": "human:fixture"
}
